LIBELLE,CLI_ID
VAO RGE IMPRESSION 32 IT/CO AOU14 L4 3ML,4286
VAO RGE PRUSSIEN HIV13 ANI LUM4 3ML,1516
VAO ROSE A L'EAU A/T MAI10 LUM3 3ML,1
VAO ROSE DELICAT 16 IT/COL AOU14 LU4 3ML,5056
VAO ROSE GIVRE 14 HIV14 ANI LU4 3ML,3936
VAO ROSE JOYEUX IT/COL AOUT13 LU4 3ML,351
VAO ROSE PASTEL 11 LUM4 3ML,9295
VAO ROSE SORBET 12 LUM4 3ML,11892
VAO ROSE VIF ETE14 ANI LUM4 3ML,6819
VAO ROSE14 IT/COL FEV14 LUM4 3ML,7714
VAO ROUGE DAHLIA IT/COL AOUT13 LU4 3ML,1133
VAO ROUGE GROSEILLE 31 LUM4 3ML,11665
VAO SAPIN NOEL11 AX/TD LU3 3ML,5
VAO TENDRE JAUNE 90 IT/COL AOUT14 L4 3ML,2309
"VAO TOP COAT OPALE109 OS13 CN3 5,5ML",1268
VAO TOPCO ARGEN NACR IT/COL FEV14 L4 3ML,4995
VAO TOPCO BLEU NACRE IT/COL FEV14 L4 3ML,3652
VAO TOPCO FUCHIA NACR ITCOL FEV14 L4 3ML,5361
VAO TOPCO GREGE NACR IT/COL FEV14 L4 3ML,4161
VAO TRANSP ETINCELANT 01 LUM4 3ML,11483
VAO VERT ACIDULE63 IT/COL FEV14 LU4 3ML,6185
VAO VERT CANARD 61 LUM4 3ML,5781
VAO VERT D'EAU 66 IT/COL AOUT14 LUM4 3ML,6986
VAO VERT DE GRIS ETE12 LU4 ANIM 3ML,4
VAO VERT EMERAUD 65 IT/CO AOUT14 L4 3ML,4220
VAO VERT GIVRE 62 HIV14 ANI LU4 3ML,2940
VAO VIOLET ELECTRIQ 42 LUM4 3ML,8418
VAO VIOLINE AUTOMNE14 3ML,4582
VENTRE PLAT T150ml CAFE VERT,73
VINAIGRE DE RINCAGE FRAMBOISE 150ML,3858
VOILE CORPS SENTEUR NATURE 200,24
VOILE D' AMBRE  BRUME DE PARFUM DEO100ML,41
VOILE DE NACRE OR/JAU NOEL10 A/TLU3 7ML,1
VOILE DE TT CLAIR NAT 01 LU4 30ML,2454
VOILE DE TT MAT/NATUR 03 LU4 30ML,1926
VOILE DE TT MEDIUM NAT 02 LU4 30ML,2876
VOILE TT LUM3 BEIGE SOLEIL T30ML,1
ZERO TRACE SPRAY SPF 15 FL150,4817
ZERO TRACE SPRAY SPF 30 150ML,4547
x99SS GELEE FRUITS VANIL PN2 10ML,2639
