LIBELLE,CLI_ID
2010 KIT MAQ PDR,30
2013 GD PARFUME F200 ML EVIDENCE,16447
2013-GD 200ML SO ELIXIR,1002
2013-LAIT PARF 200 ML SO ELIXIR,706
2013COL 10ANS EDP50ML COMMEUNE EVIDENCE,6849
2014 COLLECT EDP 50ML COMME UNE EVIDENCE,5553
2014 COLLECTOR EDP 50ML SO ELIXIR PURPLE,575
25 LINGETTES DEFROISSANTES SV,26604
49C ANTI CHUTE CURE STIM 60ML,2551
AB SVA BRUM EXPR CORP FL150ML,3406
AB SVA GEL NACR VIetCO FL150ML,729
AB SVA JAMBES D'ETE  T75 INTER,8326
AB SVA LAIT HYDR VI/CO FL150ML,4976
AB SVA Soin Lift Vis T50 INTER,5164
ACTION ABDOS FESSIERS 150ML,5725
ACTION ANTI-CELLULITE 150ML,6808
ACTION CUISSES FUSELEES 150ML,3270
ACTIVE JOUR RICHE CREME2 50ML,2
AMPLI PROTECTYL APSOL FLP150,9135
AMPOULES RIDES ET ECLAT SV3,7609
ANTI AGE ENERGIE FL 50ML,3605
ANTI-RIDES REGARD SV3 14ML,5491
ANTIRIDE BIENFAIS JOUR 50ml RC,5
ANTIRIDE BIENFAIS YEUX RC15ML,5
ANTIRIDES BIENFAIS NUIT 50mlRC,3
AP SOL 3EN1 FL150 PROT VEG,1
APRES SHAMPOOING NUTRI BOUCLES 150ML,6832
AR PROTECTYL AP SOL T50,966
ARA NATURE POUR HOMME 75ML,4903
ARA SPLASH HOGGAR 100ML,5548
ARA SPLASH TRANSAT 100ML,1823
B.A.R SENSITIVE 100ML,9649
BA HYD LUM BX JRS COR/MOOR YRIA 5ML,4
BAIN DCHE POMME REINETTE 100ML,48
BAIN DOUCHE POMME D'API 250 ML,5
BASE ONGLES LISS/LUMIN MANUC CN3 10ML,6166
BASE ONGLES RENFORCES MANUC CN3 10ML,15193
BASE PREP A LA ROSE TT ABRICOT CN3 F15ML,1878
BASE PREP A LA ROSE TT ROSE CN3 F15ML,1326
BAUM LEVRES NOIX DE COCO 4G,2
BAUME ARA GINSENG HOMME 100ML,1
BAUME JR/NT RC OMEGA 50ml,1764
BAUME LEV FDN ORANG/CHOCOL OS10 4G,1
BAUME LEVR ABRICOT DOUX 21 LU4 7ML,1522
BAUME LEVR HYDRA REPACK 2012 4G,3
BAUME LEVR MAUVE DOUX 41 LU4 7ML,1890
BAUME LEVR NUTRI REPACK 2012 4G,1
BAUME LEVR REPAIR REPACK 2012 4G,1
BAUME LEVR ROSE DOUX 11 LU4 7ML,2027
BAUME LEVR SENT FRAMBOISE 4G,42748
"BAUME LEVR SOIN NOIX COCO 4,8G",1
"BAUME LEVR SOIN REPARAT 4,8G",1
BAUME LEVRES COCO PN2 5G VPM,465
BAUME LEVRES FRAISE PN2 5G VPM,546
BAUME LEVRES FRAMB PN2 5G VPM,480
BAUME LEVRES HYDRA 4G,18547
BAUME LEVRES NOIX DE COCO 4G,26928
BAUME LEVRES NUTRI 4G,27322
BAUME LEVRES REPAIR 4G,33684
BAUME LEVRES SOIN VANILLE 4G,22
BAUME LEVRES VANI PN2 5G VPM,490
BAUME LEVRES VANILLE 4G,26630
BAUME NOUR CACAO FRAMB NOEL COLL 4G,459
BAUME NOUR CACAO ORANG NOEL COLL 4G,2344
BAUME NOUR CACAO PISTAC NOEL COLL 4G,2216
BAUME NOUR LEV CIT VANIL OS12 FDN 4G,39
BAUME NOUR LEV FL CRIST OS12 FDN 4G,39
BAUME NOUR LEV FL FEER FDN OS11 4G,3
BAUME NOUR LEV FR MERV FDN OS11 4G,4
BAUME NOUR LEV FRUITS NOIRS OS14 4G,23058
BAUME NOUR LEV FRUITS ROUGES OS14 4G,27373
BAUME POINTES SECHES 50ML,4603
BAUME REGEN NUTRITION RC T50ml,270
BAUME REPARATEUR LEVRES 4G,1
BAUME TRAD DE HAM P150ml,6828
BB CREME LIGHT PEAU PARFAITE T50ML,5093
BB CREME MEDIUM DARK PEAU PARF T50ML,2302
BB CREME MEDIUM PEAU PARFAITE T50ML,13231
BD ABRICOT PN FL50ML,1
BD AVOINE PN2 FL400ML,11364
BD AVOINE PN2 FL50ML,2485
BD COCO PN2 FL400ML,24703
BD COCO PN2 FL50ML,16246
BD FRAISE PN2 FL400ML,9275
BD FRAISE PN2 FL50ML,9764
BD FRAMBOISE PN2 FL400ML,19598
BD FRAMBOISE PN2 FL50ML,22436
BD IRIS SECRETS ESSENCES FL200ML,47
BD MURE PN2 FL400ML,15366
BD MURE PN2 FL50ML,17695
BD OLIVE PN2 FL400ML,10149
BD OLIVE PN2 FL50ML,10831
BD PECHE PN2 50ML,14718
BD PECHE PN2 FL400ML,14273
BD PN MANDARINE FL400ML,5
BD PN MANDARINE FL50ML,144
BD PN POMME F400 ML,298
BD PN POMME F50 ML,321
BD PN VANILLE FL50ML,16156
BD SE VOILE D'AMBRE FL 200ML,253
BD SEC ESS JASM FL 200ML,1649
BD SENTEUR NATURE 200ML,2648
BD VANILLE PN2 FL400ML,19570
BEAUTY BOX COLOR PROFUSION 2011 CN3,54
BIJOU PEAU FLEURS DOREES A/T MAI11 LU3,1
BIJOUX DE PEAU NOEL11 A/T LU3,1
BIO BAUM LEV NUTR CULT BIO2 10ML,5022
BIO BAUME LEVRES REPARATEUR 10ML,301
BIO CD MAUVE FL200ML,1
BIO CR JOUR ANTI RIDES P50ml,560
BIO CR NUIT ANTI RIDES P50,394
BIO CREME DOUCHE KARITE 200 ML,12389
BIO CREME DOUCHE MAUVE 200 ML,105
BIO DEO FRAICHEUR BILLE FL50ML,11549
BIO FLUIDE REVEIL REGARD TB15ML,321
BIO GD ARGAN FL200ML,1
BIO GD FRAICHEUR FL200ML,13486
BIO GEL DOUCHE ARGAN 200 ML,11973
BIO GELEE DEMAQ FL 200 ML,147
BIO GOMMAGE  CORPS T150ML,8847
BIO HUILE PRECIEUSE SOIR STG 30ML,1
BIO HYDRA VEL VISAG CULT BIO2 T50ML,2553
BIO LAIT HYDRA CORPS FL200ML,1135
BIO LAIT NUTRI CORPS FI 200ML,1277
BIO LAIT ONTUEUX DEMAQ 200ML,1761
BIO LOTION DU COUCHER FL200ML,1
BIO MIEL DOUCHE 200ML,13689
BIO NUT CR NUT MAINS CULT BIO2 50ML,4778
BIO NUTR VISAGE CULT BIO2 50ML,3347
BIO REPACK LAIT ONCTUEUX 200 ML,347
BIO SERUM ENERGIE STG 30ML,3
"BLEMISH CORRECTOR SEBOVEGETAL 1,4G",2360
BLUSH NACRE 7G 2011 CN3,7
BLUSH NAT CLAIR/ABRICOT CN3 7G,725
BLUSH NAT CLAIR/ROSE CN3 7G,2634
BLUSH NAT MAT/ABRICOTE CN3 7G,3165
BLUSH NAT MAT/ROSE CN3 7G,6514
BLUSH NAT MEDIUM/ABRIC CN3 7G,4912
BLUSH NAT MEDIUM/ROSE CN3 7G,4247
BLUSH NATUREL 7G CN3 2013 ROSE VIF,1239
BLUSH NATUREL 7G CN3 2013 ROUGE,963
BLUSH SOLEIL CUIVRE ETE14 ANI LU4 2G,888
BOUCLES SHAMPOING SOIN 300ML SVC,8390
BRONZER NACRE ETE 2012  LUM4 ANIMATIONS,8
BRUME VITAMINEE PAMPLEMOUSSE ROSE FL50ML,4342
C JR RIDES+ECLAT SV 50ml,7993
CD ANANAS COCO PN 400ML,11
CD ANANAS COCO PN 50ML,31
CD FRUITS ROUGES PN 400ML,1061
CD JDM MACADAMIA FL 200ML,5886
CD JDM RIZ DU LAOS FL 200ML,18389
CD JDM4 AMANDE  FL 200ML,53729
CD JDM4 CAFE FL 200ML,25469
CD JDM4 COTON  FL 200ML,50256
CD JDM4 MACADAMIA FL 200ML,47483
CD JDM4 MAGNOLIA FL 200ML,51709
CD JDM4 RIZ VIOLET FL200 ML,17466
CD MANGUE PASSION PN 400 ML,1020
CD MANGUE PASSION PN 50ML,841
CD PN POIRE CARAMEL FL50Ml,9814
CD PN Poire Caramel FL750 Ml,3988
COLLECT EDP 50ML COMME EVIDENCE OS2012,6
COLLECT EDP 50ML MOMENT DEBONHEUR OS2012,12
COLLECTOR  EDP SO ELIXIR PURPLE 50ML,373
COLLECTOR CREME DOUCEUR PC 125,14000
COLLECTOR EDP SO ELIXIR 30ML,4
COLLECTOR GRAND SOIN RC2  75ml,381
CONCENTRE MINCEUR TRIPL ACTION T150ML,37
CONCENTRE REP SVC P45ML,2186
CONTOUR YEUX 15ml SV40,6225
CONTOUR YEUX AntiAge GLOBAL 15,8729
CONTOUR YX BS AC.SENS.15ML,4447
CORRECT A LA ROSE TT CLAIR CN3 5G,3510
CORRECT A LA ROSE TT MAT CN3 5G,671
CORRECT A LA ROSE TT MEDIUM CN3 5G,1984
CORRECT A LA ROSE TT TRS CLAIR CN3 5G,2721
CORRECT ANTI TACHES 0 DEFAUT 14ML,441
CORRECT FLUID MEDIUM 02 LU4 7ML,2606
CORRECT FLUIDE CLAIR 01 LU4 7ML,3015
CR AA JR PxSECHE ELIXIR P40ml,7586
CR AFFINANT POT 50 ML SEBOSPECIFIC,1197
CR ANT/ROUG B/SP AC.SENS P50,5577
CR ANTIAGE NT ELIXIR7.9 P40ml,9481
CR CORPS FONDANTE P150ml NOEL1,3019
CR ECLAT INOSITOL P40ml,12
CR FOND JOUR SPF20 AAG T50ml,2413
CR FONDAMENT PEAU SECHE  AAG50,6541
CR FONDAMENTALE JOUR AAG 50ml,16207
CR HYDRATAT SPF25 HYDR/VEG 50ML,7378
CR J PX N a M ELIXIR 7.9 P40ML,14239
CR J SERUM FONDAMEN AAG FL30ml,8290
CR JOUR 1e RIDE HYDRA/VEG T30ML,1833
CR JOUR GELEE PC P50ml,3
CR JOUR NUTRI NUT/VEG P50ML,12590
CR JOUR PX/MIX HYDRA/VEG P50ML,19845
CR JOUR PX/SEC HYDRA/VEG P50ML,13787
CR JOUR SEBOSPECIFIC POT 50 ML,1474
CR JOUR SEBOSPECIFIC T40ML,476
CR JOUR/NUIT PC pot50,14117
CR JOUR/NUIT PC tub40,1669
CR JR PARF BIO.SPE AC.SENT.50ML,9441
CR MAINS AVOINE PN2 FP200ML,1020
CR NUIT NUTRI INTENSE NUT/VEG P50ML,4529
CR REGENERAT J/N50ml PURE CAL,10494
CR RESPLENDISS JR SPF20 SV50ml,5760
CR SECURIT EXT IP50 T 75ML PRO VEG,2422
CR TT BXJRS YRIA SOL/CLAIR 50ML,1
"CRAY ARGENT 91 HIV14 ANI LU4 3,25G",791
"CRAY FAP JUMB UHT BLEU/NUI 51 LU4 3,25G",1872
"CRAY FAP JUMB UHT BRUN/DORE 71 LU4 3,25G",1345
"CRAY FAP JUMB UHT ROSE/TAUP11 LU4 3,25G",1720
"CRAY FAP JUMB UHT VIOL/ELECT41 LU4 3,25G",1250
"CRAY KHOL BLEU NUIT 51 LUM4 1,3gr",10055
"CRAY KHOL BRUN 71 LUM4 1,3gr",12102
"CRAY KHOL NOIR 81 LUM4 1,3gr",42421
"CRAY REG ANTHRAC/PRO HIV13 ANI LU4 3,25G",981
"CRAY REG BLEU MEDIT ETE14 ANI LU4 3,25G",1969
"CRAY REG BLEU ROI ETE14 ANI LU4 3,25G",1572
"CRAY REG BRUN CUIVRE ETE14 ANI LU4 3,25G",672
"CRAY REG EUCAL ETE13 ANI LU4 3,25G",310
"CRAY REG JAUNE CITR ETE14 ANI LU4 3,25G",465
"CRAY REG LYS/NACR IT/COL FEV14 LU4 3,25G",1315
"CRAY REG MAUV/ANCIEN HIV13 ANI LU4 3,25G",666
"CRAY REG MENTHE IT/COL FEV14 LU4 3,25G",1235
"CRAY REG OPALE DORE  NOEL12 L4 ANI 3,25G",164
"CRAY REG ORCHROS ETE13 ANI LU4 3,25G",287
"CRAY REGARD CUIVRE NOEL11 A/T LU3 2,69G",2
CRAY REGARD PAILLET/ARGENTCN3 1.12G,1874
CRAY REGARD PAILLET/OR CN3 1.12G,1126
CRAY REGARD ROS/PAILLET CN3 1.12G,928
"CRAY VERT 62 HIV14 ANIM LU4 3,25G",312
CRAYON BLANC MANUCURE CN3 1.1G,2173
CRAYON KHOL BRUN LUM3 1.2G,2
CRAYON KHOL NOIR LUM3 1.2G,2
CRAYON LEVR BOIS/ROSE CN3 1G,943
CRAYON LEVR NUDE/BEIGE CN3 1G,930
CRAYON LEVR NUDE/ROSE CN3 1G,34
CRAYON LEVRES BRUN CN3 1G,1589
CRAYON LEVRES MAUVE CN3 1G,1174
CRAYON LEVRES ORANGE CN3 1G,60
CRAYON LEVRES ROSE CN3 1G,1138
CRAYON LEVRES ROUGE CN3 1G,1049
CRAYON REGARD ANTHRACIT CN3 1.3G,4993
CRAYON REGARD BLANC CN3 1.3G,3350
CRAYON REGARD BLEU CN3 1.3G,5385
CRAYON REGARD BRONZE CN3 1.3G,962
CRAYON REGARD BRUN CN3 1.3G,7543
CRAYON REGARD CUIVRE CN3 1.3G,1353
"CRAYON REGARD INDIGO NOEL12 L4 ANI 3,25G",172
CRAYON REGARD NOIR CN3 1.3G,14513
CRAYON REGARD PRUNE CN3 1.3G,4134
CRAYON REGARD VERT CN3 1.3G,4324
CRAYON SOURCILS BLOND CN3 1.1G,3346
CRAYON SOURCILS BRUN CN3 1.1G,8537
CRAYON SOURCILS CENDRE CN3 1.1G,5816
CRAYON SOURCILS CHATAIN CN3 1.1G,6375
CREME AR IP30 PTYL V 50ml,4070
CREME ARNICA ESSENTIEL 75 ML,1
CREME DCHE PN POIRE CARAMEL 400 ML,10523
CREME DEMAQ 3 THES T150ml,43
CREME FOND AVOINE PN200ML VPM,462
CREME FOND COCO PN P200ML VPM,723
CREME FOND OLIVE PN 50ml VPM,48
CREME FOND OLIVE PN P200ML VPM,310
CREME FOND VANILLE PN 50ml VPM,62
CREME FOND VANILLE PN200ML VPM,476
CREME MAINS 75ML CACAO  PISTACHE,2172
CREME MAINS 75ML CACAO FRAMBOISE,565
CREME MAINS ANTIRIDES RC T50ml,5455
CREME MAINS CACAO ET ORANGE 75ML,2238
CREME MAINS CACAO ORANGE T75 Ml,13016
CREME MAINS FRUITS NOIRS T75 ML,25472
CREME MAINS HYD T30 Ml CITR VAN,62
CREME MAINS HYD T75 CITR VAN,60
CREME MAINS HYD T75 FL CRIST,74
CREME MAINS OLIVE PN2 200ML,1324
CREME MAINS T30 CACAO ET FRAMBOISE,1755
CREME MAINS T75 ml FRUITS ROUGES,25176
CREME MAINS VANILLE PN2 FP200ML,1083
CREME NUIT AntiAge GLOBAL 50ml,10959
CUBE BAIN MANDARINE D' ITALIE 2011,281
CUBE DE BAIN COCO PN2 20G,25958
CUBE DE BAIN FRAISE PN2 20G,16061
CUBE DE BAIN FRAMBOISE PN2 20G,30506
CUBE DE BAIN MURE PN2 20G,27690
CUBE DE BAIN PECHE PN2 20G,19971
CUBE DE BAIN VANILLE PN2 20G,22385
CUBE PETILLANT POIRE 15g,10033
CUBE PETILLANT POMME 20g,19
CUBE VANILLE ED OR 2013 15G,1623
CURE 28 JRS AA GLOBAL 4X7ML,387
Collector CVC ORANGE pot50ml,475
Collector CVC vert pot50ml,397
Collector CVC violet pot50ml,290
Cr Fond Noix de Coco PN50mlVPM,51
Cr Mains hyd 75ml OranAman FDN,1
D FRUITS ROUGES PN 50 ML,729
D LOTUS DU LAOS JDM3 200ML,4323
DCHE 2EN1 HAMAMELIS FL300,3573
DCHE PURE HAMAMELIS FL300ML,2431
DEMAQ ANTI-IMPER 150ML SEBOSPECIFIC,834
DEMAQ DOUCEUR PUR BLEUET FL125ML,1
DEMAQ EXPRESS PUR BLEUET FL125ML,158762
DEMAQ YX BS AC.SENS 150ML,3762
DEMAQ+TONIQUE PC 200ML,23201
DEMAQ.EXPRESS YEUX BLEUET 125,3
DEO  PARFUME VANILLE NOIRE S.E 100ML,3
DEO 100ML   AMBRE NOIR,5878
DEO AERO SENTEUR NATURE 75ML,8384
DEO AEROSOL CLEA 100 ML,2
DEO BILLE 50ML HOGGAR,181
DEO BILLE 50ML TRANSAT,71
DEO BILLE HAMAMALIS 50ML,2
DEO BILLE HOGGAR 50ML,5695
DEO BILLE JDM CITRON FL50ML,10
DEO BILLE JDM COTON FL50 ML,36
DEO BILLE JDM LOTUS FL50ML,4
DEO BILLE TRANSAT 50ML,1941
DEO BILLE VETIVER FL50ML,20
DEO HOMME  EVIDENCE  GREEN 100ML,1088
DEO JASMIN SEC ESS AEROSOL 100ML,23
DEO JDM LAVANDE PROVENCE FL50ML,23
DEO JDM PULPE ALOE VERA FL50ML,1
DEO JDM4 AMANDE FL 50 ML,12856
DEO JDM4 COTON  FL50ML,17978
DEO JDM4 LAVANDIN FL50ML,15301
DEO JDM4 LOTUS FL50ML,23528
DEO MOMENT DE BONHEUR  AEROSOL 100ML,3414
DEO PARFUME  SO ELIXIR 100ML,1634
DEO PARFUME 100ML EVIDENCE,23990
DEO PARFUME 100ML SO ELIXIR PURPLE,2844
DEO PARFUME NATURE HOMME 100ML,5124
DEO ROSE SECRET  FL 100ML,1
DEO SPRAY EVIDENCE HOMME 100ML,5603
DEODORANT SENSITIVE 50ML,925
DESINCRUSTANT ENERGIE T 100ML,4571
DISSOLVANT FLACON MANUC CN3 100ML,44890
DISSOLVANT STYLO MANUC CN3 3ML,4866
DOUCH GOMMANTE F ROUGES F200 ML,14253
DOUCH GOMMANTE FRUITS NOIRS T 200 ML,13187
DUO BEAUTE ECLAT 2X6ML GEST/INST,342
DUO BRONZER HALE LEGER CN3 10.5G,3134
DUO BRONZER HALE MAT CN3 10.5G,3145
DUO ILLUMIN ECL/UNIVERSEL CN3 10.5G,2
DUO ILLUMINA ECL/ROS OS09 CN3 10.5G,2
DUO KHO BLEU/ORA/PAON HI13 ANI L4 2X0.52,245
DUO KHO GRIS/MANDAR HIV13 ANI L4 2X0.52G,337
DUO KHO MENTROP/BOU ETE13 ANI LU4 2X0.52,289
DUO KHO VER/BLPROF ETE13 ANI LU4 2X0.52,226
"DUO KHOL AMETH/VER NOEL12 L4 ANI 2X0,52G",139
DUO KHOL CUIVR/BRUN NOEL11A/TLU3 2X0.52G,13
DUO KHOL KAKI/CAMEL ETE12 LU4 ANI 2X0.52,11
"DUO KHOL MAUV/MARI NOEL12 L4 ANI 2X0,52G",163
"DUO KHOL OR/VERT NOEL11A/T LU3 2X0,52G",3
DUO KHOL POURP/OR ETE12 LU4 ANI 2X0.52,6
DUO PDRE HAL/MAT02 AX/SOLA CN3 20G,10133
EAU DE SOIN VEGETALE 100ML,4320
EAU DEMAQ PUR BLEUET FL200ML,17193
EAU DEMELANTE 200ML,4612
"EAU DES CILS OR/TRANS ETE12 L4 ANI 4,5ML",3
EAU FRAICHE P/API 75ML 2003,32
EAU MICELLAIRE 3 THES FL200ML,22663
EAU MICELLAIRE HYDRATANTE 200ML,15738
EAU MICELLAIRE PURIFIANTE 2EN1 200 SEBO,14463
EAU NACRES ARGENT ANI HIV13 LU4 30ML,190
EAU PARF EXOT MONOI TAHITI 125,91
EAU POMME  DE REINETTE VAPO 75ML,2
EAU SCINTIL OR COLLECTOR14 30ML,961
EDC FRAICHEUR CEDRE BLEU 125ML,4
EDC FRAICHEUR VERVEINE 125ML,23686
EDC THE VERT VAPO 125ML  F . V,24004
EDP  SO  ELIXIR VAPO 30ML,5678
EDP 30ML SO ELIXIR PURPLE,7941
EDP 50ML SO  ELIXIR  PURPLE,4841
EDP AMBRE S.E VAPO 30ML,698
EDP COCON NEONATURA VAPO 50ML RELIFT,3
EDP COMME UNE EVIDENCE VAPO SAC15ML OS13,1607
EDP EVIDENCE 50 EDITION LIMITE 2007,1
EDP EVIDENCE 50ML RELIFTING,30093
EDP EVIDENCE VAPO 100ML,16113
EDP EVIDENCE VAPO DE SAC 15ML,12
EDP FLOWERPARTY BY NIGHT 30ML,2682
EDP FLOWERPARTY BY NIGHT 50ML,2805
EDP INTENSE  EVIDENCE VAPO DE SAC 15ML,524
EDP INTENSE EVIDENCE 50ML,16608
EDP IRIS NOIR S.E VAPO 30ML,3
EDP IRIS NOIR SE VAPO 50ML,290
EDP JASMIN SE VAPO 30ML,5436
EDP JASMIN SEC ESS VAPO 50ML,4027
EDP JASMIN SEC ESS VAPSAC 15ML,2
EDP MING SHU 30 ML,3
EDP MOMENT DE BONHEUR VAPO 30ML,6197
EDP MOMENT DE BONHEUR VAPO 50ML,4419
EDP NEROLI SECRETS ESSENCES  50ML,4083
EDP NEROLI SECRETS ESSENCES 30ML,5172
EDP QQUES NOTES D'AMOUR  30ML,7634
EDP QQUES NOTES D'AMOUR 50ML,9168
EDP S.E. TEND JASMIN  VAPO SAC 15ML OS13,6
EDP SE VOILE D'AMBRE VP 50ML,1313
EDP SO   ELIXIR VAPO 50ML,4376
EDP SO ELIXIR VAPO SAC 15ML,10
EDP UN BONHEUR VAPO SAC 15ML,47
EDP VANILLE NOIRE S.E VAPO 30ML,1674
EDP VANILLE NOIRE S.E VAPO 50ML,1727
EDP VANILLE NOIRE SE EDIT LIMIT 30ML,5
EDP VAPO DE SAC 15ML QQNA OSFA 2015,460
EDP VAPO DE SAC 15ML SO ELIXIR PURPLE,71
EDP YRIA 30 ML,1
EDP YRIA 50 ML,77
EDT  75ML COLLECTION ETE  2014,12408
EDT  FRUITS ROUGES PN 100ML  VPM,760
EDT  FRUITS ROUGES PN 20 ML,616
EDT  POIRE CARAMEL  PN 100ML  VPM,6019
EDT  UMAJ  100ML  CERISIERS EN FLEURS,17268
EDT  UMAJ  20ML  CERISIERS EN FLEURS,738
EDT  UN MATIN AU JARDIN  100ML  MUGUET,14236
EDT  UN MATIN AU JARDIN  20ML  MUGUET,1365
EDT 100ML   AMBRE NOIR,7445
EDT 2014 FRUITS NOIRS  50ML,3161
EDT 50ML  AMBRE NOIR,5490
EDT ANANAS COCO PN 100ML VPM,153
EDT ANANAS COCO PN 20ML,62
EDT CLEA VAPO 75ML,32
EDT EAU DES LAGONS MONOI DE TAHITI 100ML,16571
EDT EVIDENCE H GREEN VP 75ML,2223
EDT EVIDENCE HOMME  VAPO 75ML,10123
EDT FLOWERPARTY VAPO 30ML,6052
EDT FLOWERPARTY VAPO 50ML,6011
EDT FLOWERPARTY VAPO SAC 15ML,32
EDT FRAISE PN2 100ML VPM,2933
EDT FRAISE PN2 20ML,9749
EDT FRAMBOISE PN 20ML,24032
EDT FRAMBOISE PN2 100ML VPM,7765
EDT IRIS NOIR S.E VAPO 75ML,2
EDT L'EAU MOMENT DE BONHEUR 50ML,8691
EDT LILAS VAPO 60ML PUR DESIR,1
EDT MANDARINE ITALIE PN 20ML,43
EDT MANDARINE ITALIE VPM PN100ML,8
EDT MANGUE PASSION PN 100ML VPM,722
EDT MANGUE PASSION PN 20ML,829
EDT MARRONS DE NOEL P.N OS09 VPM 100ML,1
EDT MAUVES  CRISTALLISEES 50ML O.S.2012,111
EDT MURE PN2 100ML VPM,5073
EDT MURE PN2 20ML,14377
EDT NATURE HOMME VAPO 50ML,10114
EDT NATURE VAPO 60ML,11958
EDT NATURELLE VAPO 75ML,2025
EDT NOIX DE COCO PN 100ML VPM,12664
EDT NOIX DE COCO PN2 20ML,20804
EDT ODE A L' AMOUR PASSIONNEMENT30ML,1
EDT ODE A L'AMOUR 50ML,1
EDT PECHE PN2 100ML VPM,3381
EDT PN 100ML  EAU INT VAN.EDOR VPM OS13,493
EDT PN 100ML  POMME DELICE VPM O.S.2012,8
EDT PN 20ML  EAU INT VAN.ED.OR VPM OS13,1945
EDT PN 20ML  POMME GOURM  O.S.2012,6
EDT PN2 PECHE 20ML,11772
EDT POIRE CARAMEL PN 20ML,9756
EDT RETROPICAL 75ML  ANIM 2013,700
EDT SO ELIXIR VAPO 30ML,567
EDT SO ELIXIR VAPO 50ML,400
EDT UN MATIN AU JARD 100ML FL. D'AGRUMES,7686
EDT UN MATIN AU JARD 20ML FL. D'AGRUMES,922
EDT UN MATIN AU JARDIN 100ML LILAS,11147
EDT UN MATIN AU JARDIN 100ML ROSE,11323
EDT UN MATIN AU JARDIN 20ML LILAS,1199
EDT UN MATIN AU JARDIN 20ML ROSE,1237
EDT VANILLE PN2 100ML VPM,13291
EDT VANILLE PN2 20ML,21263
EDT VAPO 75 ML TRANSAT,4340
EDT VAPO 75ML HOGGAR,16815
ELIXIR 7.9 COLLECTOR 2012 30ml,472
ELIXIR 7.9 Int Jeunesse30ml CS,444
ELIXIR DE BEAUTE2 RICHE CR10ML,92
ELIXIR EXFOLIANT VEGETAL TU75ML,5528
ESSENCE RIDES  FERMETE SV3 30ML,6316
ETINCELL SOLEIL/CUIVR A/T NOEL11 LU3 7ML,1
ETINCELLE OR NOEL12 LUM4 ANIM 7ML,57
EVIDENCE L' EAU 75ML,6100
EXFOLIANT FRAISE PN P200 VPM,90
EXFOLIANT OLIVE PN 50ml VPM,50
EXFOLIANT OLIVE PN2 P200ML VPM,631
EXFOLIANT PECHE PN 50ml VPM,52
EXFOLIANT PECHE PN2 P200ML VPM,473
EXFOLIANT TRAD DE HAM P150ml,8087
EXFOLIANT VANILLE PN 50ml VPM,31
EXFOLIANT VANILLE PN2 200ML VPM,663
EYE LINER BRUN03 CN3 2.5ML,2584
EYE LINER EMERAUDE05 CN3 2.5ML,1809
EYE LINER NOIR 02 CN3 2.5ML,8269
"EYE LINER NOIR 81 LUM4 2,5ML",9795
EYE LINER NOIR CN3 2.5ML,12029
EYE LINER PRUNE06 CN3 2.5ML,2014
EYE LINER SAPHIR04 CN3 2.5ML,2159
"EYELINER ARGEN ETINC HIV13 ANI LU4 2,5ML",230
"EYELINER OR NOEL12 LUM4 ANIM 2,5ML",82
FAJ POUDRE ABRICOT LUM4 2G,3067
FAJ POUDRE ROSE LUM4 2G,1615
FAJ POUDRE ROSE LUMINELLE4 2G,1013
FAP CR METAL BRONZE CN3 5ML,1
FAP CR METAL CHROME CN3 5ML,4
FAP CR METAL CUIVRE CN3 5ML,2
FAP CR METAL MERCURE CN3 5ML,8
FAP CR METAL OR CN3 5ML,4
FAP CR PASTEL AUB/ROSEE CN3 5ML,5
FAP CR PASTEL AUROR/DORE CN3 5ML,5
FAP CR PASTEL BLEU/HORIZON CN3 5ML,4
FAP CR PASTEL MAUV/BRUME CN3 5ML,7
FAP CR PASTEL SOUFFL/BLANC CN3 5ML,11
FAP CR PASTEL VERT/BOCAG CN3 5ML,3
FAP DUO 2012  CN3 3G  SABLE  ET AMBRE,2028
FAP DUO 2012  CN3 3G AZUR  ET BLEU NUIT,946
FAP DUO 2012  CN3 3G OR ET ULTRA MARINE,521
FAP DUO 2012 CN3 3G GREGE ET TURQUOISE,822
FAP DUO 2012 CN3 3G KAKI ET VERT DE GRIS,1296
FAP DUO 2012 CN3 3G NOIR ET GRIS SMOKY,1488
FAP DUO 2012 CN3 3G PRUNE ET TAUPE PDRE,1832
FAP DUO 2012 CN3 3G ROSE NUDE ET BRUN,2797
FAP DUO BLEUET/JACINTH CN3 3G,7
FAP DUO LYS TULIP/NOIRE CN3 3G,4
FAP DUO MAUVE ET KAKI CN3 3G,6
FAP DUO MENTHE/ECORCE CN3 3G,1
FAP DUO PECHE/NOISETTE CN3 3G,6
FAP DUO PISTACH/PRUNE CN3 3G,6
FAP DUO TOURNESOL/CANNEL CN3 3G,1
FAP ENLUMINEUR  OR CUIVRE 2G LUM 4 VPM,2380
FAP ENLUMINEUR B LANC NEIGE 2G LUM 4 VPM,4950
FAP ENLUMINEUR OR BLANC 2G LUM4 VPM,3760
FAP ETE2012  VERTDEGRIS 2G LUM4 ANIM VPM,2
FAP MONO  BEIGE DORE CN3 3g,33
FAP MONO  BRUN  CUIVRE CN3 3g,110
"FAP MONO 2013 CN3    FIGUE  2,5G",1474
"FAP MONO 2013 CN3   2,5G   BLEU AZUR",1771
"FAP MONO 2013 CN3   2,5G   ROSE  POIVRE",1
"FAP MONO 2013 CN3   2,5G   ROSE NUDE",3768
"FAP MONO 2013 CN3   2,5G  BLEU CIEL",2569
"FAP MONO 2013 CN3   ANTHRACITE  2,5G",684
"FAP MONO 2013 CN3   ARGENT  2,5G",1311
"FAP MONO 2013 CN3   BRONZE  2,5G",1123
FAP MONO 2013 CN3   GRIS FUME MAT  2G,263
FAP MONO 2013 CN3   ROSE THE MAT  2G,1258
"FAP MONO 2013 CN3   VERT  PAON  2,5G",590
"FAP MONO 2013 CN3  2,5G   ABSINTHE",1350
"FAP MONO 2013 CN3  2,5G   BLEU  ABYSSE",693
"FAP MONO 2013 CN3  2,5G   EUCALYPTUS",760
"FAP MONO 2013 CN3  2,5G   VERT  EMPIRE",366
"FAP MONO 2013 CN3  2,5G  BEIGE DORE",2565
"FAP MONO 2013 CN3  2,5G  PECHE",2539
FAP MONO 2013 CN3  BLEU  INDIGO  MAT 2G,223
FAP MONO 2013 CN3  BRUN  CAFE MAT  2G,494
FAP MONO 2013 CN3  BRUN CENDRE MAT 2G,828
"FAP MONO 2013 CN3  BRUN SCINTILLANT 2,5G",1323
FAP MONO 2013 CN3  NOIR EBENE MAT  2G,671
"FAP MONO 2013 CN3  NOIR SCINTILLANT 2,5G",1089
"FAP MONO 2013 CN3  OR  SCINTILLANT  2,5G",1863
FAP MONO 2013 CN3  ROSE BOISE MAT  2G,1005
"FAP MONO 2013 CN3  TAUPE  ROSE  2,5G",3182
"FAP MONO 2013 CN3  VERT  TURQUOISE 2,5G",1101
"FAP MONO 2013 CN3  VERT EMERAUDE  2,5G",388
FAP MONO 2013 CN3  VIOLET  POP MAT  2G,979
"FAP MONO 2013 CN3 2,5G BLANC PERLE",3413
"FAP MONO 2013 CN3 2,5G BRUN CACAO",1513
"FAP MONO 2013 CN3 2,5G BRUN CANNELLE",1683
"FAP MONO 2013 CN3 2,5G CUIVRE",1918
"FAP MONO 2013 CN3 BLEU SCINTILLANT  2,5G",1440
"FAP MONO 2013 CN3 CUIVRE SCINTILLANT2,5G",1005
"FAP MONO 2013 CN3 ETAIN SCINTILLANT 2,5G",2412
FAP MONO 2013 CN3 ORANGE FLASH MAT  2G,298
FAP MONO BAIE ROSE CN3 3g,102
FAP MONO BLANC NARCISSE CN3 3g,63
FAP MONO BLEU CLEMATITE CN3 3g,76
FAP MONO BLEU LAVANDE CN3 3g,98
FAP MONO BLEU VOLUBILIS CN3 3g,97
FAP MONO BOUTON D'OR CN3 3g,4
FAP MONO BRONZE LICHEN CN3 3g,90
FAP MONO BRUN AMANDE CN3 3g,144
FAP MONO BRUN CAFE CN3 3g,112
FAP MONO BRUN CHATAIGNE CN3 3g,110
FAP MONO BRUN GIROFLEE CN3 3g,52
FAP MONO FIGUE NOIRE CN3 3g,82
FAP MONO FLEUR D'ORANGER CN3 3g,70
FAP MONO INDIGO CN3 3g,8
FAP MONO MAUVE IRIS CN3 3g,113
FAP MONO MAUVE PETALE CN3 3g,121
FAP MONO NOIR EBENE CN3 3g,86
FAP MONO ORCHIDEE D'ARGENT CN3 3g,64
FAP MONO RAISIN NOIR CN3 3g,84
FAP MONO ROSE AZALEE CN3 3g,59
FAP MONO ROSE CAMELIA CN3 3g,83
FAP MONO ROSE EGLANTINE CN3 3g,155
FAP MONO TAUPE BRUYERE CN3 3g,88
FAP MONO TURQUOISE RESEDA CN3 3g,109
FAP MONO VERT ABSINTHE CN3 3g,100
FAP MONO VERT FOUGERE CN3 3g,95
FAP MONO VIOLETTE CN3 3g,91
FAP PDRE BLEU ACIER 2G  LUMINELLE 4  VPM,3514
FAP PDRE GRIS  TAUPE 2G  LUMINELLE 4 VPM,3784
FAP PDRE LILAS/VIO LU3 MONDE3.3G VAD,5
FAP PDRE MAUVE CHRYSTAL  2G LUMIN 4  VPM,4060
FAP PDRE NOIR SCINTILANT 2G  LUMIN 4 VPM,1433
FAP PDRE PECHE NUDE LUM4 VPM 2G,1103
FAP PDRE ROSE PETALE LUM4 VPM 2G,1223
FAP PDRE VERT CANARD 2G  LUMINELLE 4 VPM,1184
FAP PDRE VIOLET SCINTIL 2G  LUMIN 4  VPM,830
FAP POUDRE BRUN 2G  LUMINELLE  4  VPM,1862
FAP QUAT TONS PDRE OR ROS OS12 CN3 4G,15
FAP TRIO  BOIS DE ROSE 10 CN3 3G,177
FAP TRIO  BRUN/AMBRE 21 CN3 3G,142
FAP TRIO  MAUVE/CENDRE 20 CN3 3G,132
FAP TRIO  TAUPE/FUME 31 CN3 3G,116
FAP TRIO BEIGE NUDE 11 CN3 3G,71
FAP TRIO PRUNE ROSE 30 CN3 3G,119
FDT  ROSE BEIG400 TT MAT CN3FL30,340
FDT 0/DEF BEIG100 TR/CLAIR CN3 30,1946
FDT 0/DEF BEIG200 CLAIR CN3 30,6832
FDT 0/DEF BEIG300 MEDIUM CN3 30,7333
FDT 0/DEF BEIG400 MAT CN3 30,4366
FDT 0/DEF BRUN500 TRES MAT CN3 30,1587
FDT 0/DEF BRUN600 FONCE CN3 30,954
FDT 0/DEF BRUN700 TRS FONC CN3 30,330
FDT 0/DEF ROSE100 TR/CLAIR CN3 30,1689
FDT 0/DEF ROSE200 CLAIR CN3 30,4764
FDT 0/DEF ROSE300 MEDIUM CN3 30,4833
FDT 0/DEF ROSE400 MAT CN3 30,2441
FDT CR BEIG100 TRES CLAIR CN3 40,941
FDT CR BEIG200 CLAIR CN3 40ML,3057
FDT CR BEIG300 TEINT MEDIUM CN3 40,3287
FDT CR BEIG400 TEINT MAT CN3 40,3386
FDT CR ROSE100 TRES CLAIR CN3 40,722
FDT CR ROSE200 CLAIR CN3 40ML,1887
FDT CR ROSE300 TEINT MEDIUM CN3 40,2546
FDT CR ROSE400 TEINT MAT CN3 40,1598
FDT FL/MAT BEIG100 TR/CLAIR CN3 30,629
FDT FL/MAT BEIG200 CLAIR CN3 30,1584
FDT FL/MAT BEIG300 MEDIUM CN3 30,1100
FDT FL/MAT BEIG400 MAT CN3 30,720
FDT FL/MAT ROSE100 TR/CLAIR CN3 30,239
FDT FL/MAT ROSE200 CLAIR CN3 30,1175
FDT FL/MAT ROSE300 MEDIUM CN3 30,783
FDT FL/MAT ROSE400 MAT CN3 30,336
FDT PDRE LIBRE CLAIR CN3 4G,350
FDT PDRE LIBRE MAT CN3 4G,232
FDT PDRE LIBRE MEDIUM CN3 4G,388
FDT PDRE LIBRE TRES CLAIR CN3 4G,160
FDT PINCEAU ECL/TRES CLAIR CN3 15,1
FDT PINCEAU ECLAT CLAIR CN3 15,4
FDT PINCEAU ECLAT MAT CN3 15,4
FDT PINCEAU ECLAT MEDIUM CN3 15,1
FDT PUR LIG BGE 800 CHOCOLAT CN3 30ML,315
FDT PUR LIG BGE700 CAPPUCCINO CN3 30ML,491
FDT PUR LIG DORE300 TT TRES MAT CN3 30ML,711
FDT PUR LIGH BEIGE 200 TT CLAIR CN3 30ML,4635
FDT PUR LIGH BEIGE 400 TT MAT CN3 30ML,2470
FDT PUR LIGH BEIGE 600 CARAMEL CN3 30ML,734
FDT PUR LIGH BGE 100TT TR CLAIR CN3 30ML,2293
FDT PUR LIGH BGE 300 TT MEDIUM CN3 30ML,4069
FDT PUR LIGH BGE 500 TT TR MAT CN3 30ML,1006
FDT PUR LIGH DORE 200 TT MAT CN3 30ML,920
FDT PUR LIGH ROSE 200 TT CLAIR CN3 30ML,3284
FDT PUR LIGH ROSE 300 TT MEDIUM CN3 30ML,2873
FDT RAYON JEUNES BGE DORE200 CN3 30ML,984
FDT RAYON JEUNES BGE ROSE200 CN3 30ML,1854
FDT RAYON JEUNES BGE ROSE300 CN3 30ML,1925
FDT RAYON JEUNESSE BEIGE000 CN3 30ML,268
FDT RAYON JEUNESSE BEIGE100 CN3 30ML,636
FDT RAYON JEUNESSE BEIGE200 CN3 30ML,2803
FDT RAYON JEUNESSE BEIGE300 CN3 30ML,2885
FDT RAYON JEUNESSE BEIGE400 CN3 30ML,1767
FDT RAYON JEUNESSE BGE ROSE000 CN3 30 ML,250
FDT RAYON JEUNESSE BGE ROSE100 CN3 30ML,583
FDT ROSE BEIG100 TT TRES CLAIR CN3FL30,123
FDT ROSE BEIG200 TT CLAIR CN3FL30,404
FDT ROSE BEIG300 TT MEDIUM CN3FL30,382
FDT ROSE ROS100 TT TRES CLAIR CN3FL30,120
FDT ROSE ROS200 TT CLAIR CN3FL30,369
FDT ROSE ROS300 TT MEDIUM CN3FL30,475
FDT ROSE ROS400 TT MAT CN3FL30,291
FDT SEC/PEAU BEIG100 TR/CLAIR CN3 30,4
FDT SEC/PEAU BEIG200 CLAIR CN3 30,5
FDT SEC/PEAU BEIG300 TEINT MEDIUM CN3 30,11
FDT SEC/PEAU BEIG400 TEINT MAT CN3 30,4
FDT SEC/PEAU ROSE100 TR/CLAIR CN3 30,1
FDT SEC/PEAU ROSE200 CLAIR CN3 30,2
FDT SEC/PEAU ROSE300 TEINT MEDIUM CN3 30,6
FDT SEC/PEAU ROSE400 TEINT MAT CN3 30,5
FDT SOLEIL HALE INTENS CN3 4G,90
FDT SOLEIL HALE NATUR CN3 4G,101
FEUTRE LINER NOIR 01 CN3 1.2G,15489
FL REGENE CELLUL NOCT40 ADN2,1
FLUID PERF ANT TACH SPF 0 DEF 50ML,349
FLUID SECHAG EXPRESS MANUC CN3 5.5ML,3645
FLUIDE CELLULITE F200 MINCEUR CAFE VERT,34
FLUIDE SUBLIMATEUR ECLAT OS12 CN3 30ML,49
FRAICHEUR BAMBOU EDC 125ML,1
FRAICHEUR CHEVREF EDC 125ML,40188
FRAICHEUR SH DCHE BAMBOU 200ML,18
FRAICHEUR SH DCHE CHEVREF 200,7475
FV CHEVREFEUIL DEO BILLE 50ML,3
FV THE VERT DEO BILLE 50ML,1
FV VERVEINE DEO BILLE 50ML,2
Fluide AR RICHE CREME2 FL50ml,2847
GD  CACAO AFRIQUE FL 200 ML JDM3,5
GD  ORCHIDE DE MADAGASCAR FL 200 ML JDM3,3
GD 200 ML SO ELIXIR PURPLE,1862
GD 200ML AMBRE NOIR,7972
GD AGRUMES FP FL 200 ML,7721
GD AMANDE DE CALIF JDM3 FL200ML,1922
GD CACAO ORANGE 200 Ml,21121
GD EVIDENCE H GREEN T200ML,1454
GD EVIDENCE HOMME T200ML,6590
GD FL ORANGE FLORIDE 200 ML JDM3,2002
GD FL YLANG COMORES 200ML JDM3,1966
GD FL200ML JDM PAMPLEMOUSSE,19329
GD FLEUR DE TIARE JDM3 200ML,4005
GD FLOWERPARTY FL200ML,3309
GD GOMMANT FRAISE T200 ML,15909
GD GOMMANT FRAMBOISE T200 ML,23723
GD GOMMANT MURE T200 ML,20532
GD GOMMANT PECHE T200 ML,20706
GD GOMMANT VANILLE T200 ML,24739
GD JDM CITRON VERT  FL200ML,3692
GD JDM COTON D'INDE FL200ML,5554
GD JDM GRENADE FL200ML,6026
GD JDM HOMME VETIVER FL200ML,40
GD JDM LAVANDIN PROVENCE FL 200ML,4319
GD JDM4 CIT VERT FL 200ML,53634
GD JDM4 GRENADE FL200ML,81406
GD JDM4 LAVANDIN DE PROVENCE 200ML,54830
GD JDM4 LOTUS FL200ML,85914
