LIBELLE,CLI_ID
GD JDM4 ORANGE FL 200ML,40634
GD JDM4 PAMPLEMOUSSE FL 200ML,40898
GD JDM4 THE VERT FL200ML,37147
GD JDM4 TIARE FL 200ML,44820
GD LILAS FP FL200ML,13820
GD NATURELLE FL200,253
GD PAILLETE CACAO ORANGE 250 Ml,8848
GD PAILLETE FRUITS NOIRS 250 ML,11199
GD PARFUME 200 ML FLOWERPARTY BY NIGHT,1904
GD PARFUME L'ELIXIR FL200ML,246
GD PARFUME UN BONHEUR FL200ML,1938
GD PARFUME VANILLE NOIRE SE FL200ML,607
GD Paillete 250ML FUNTASTIC,9856
GD ROSE FP FL200ML,14548
GD SEC ESS NEROLI 200 ML,1491
GD TRANSAT 200 ML,2203
GD VANILLE COLL OR 50ML 2013,3739
GD VANILLE COLLECTOR 750ML 2013,2767
GD VANILLE ED OR 400ML 2013,1318
GEL A RASER CLEAN  & FRESH,2795
GEL ANTI BRILLANCE GINS T50ml,72
GEL CORP/CHEV 200ML CEDRE BLEU,4
GEL CR MATIFIANT SEBOVEG 50ML,6302
GEL CR ZERO DEFAUT SEBOVEG 50ML,16454
GEL DCHE CORPS/CHEVEUX 200ML ERYO,2
GEL DEFATIG ENERGIE FL 50ML,2824
GEL DOUCEUR MAINS HAMAM FL300ML,1769
GEL DOUCHE ETE 2014 200 ML,25265
GEL DOUCHE FRAICHEUR 200ML,11307
GEL DOUCHE FRAICHEUR MENTHE 200 ML,8405
GEL DOUCHE FRAICHEUR VETIVER 200ML,8269
GEL DOUCHE LOVE FI 200 ML,1747
GEL LAVANT MAINS CACAO ORANGE F200 Ml,7647
GEL LAVANT MAINS F200 FRUITS ROUGES,17464
GEL LAVANT MAINS F200ML FRUITSNOIR,15828
GEL MAINS ANTIBACTERIEN F100,3
GEL MOUSS FL200 VERVEINE FV,3364
GEL MOUSS THE VERT FV FL200 REF,4319
GEL NETT HYDRA VEG T125ML,25506
GEL NETT. PC 200ML,23291
GEL NETTOYANT FRAICHEUR 100ML,919
GEL NETTOYANT PURIFIANT 125 ML,20419
GEL PARF B/DCHE 200ML EVIDENCE,58
GEL SOS DESTOCKANT FL 165ML,3184
GELEE HYDRAT YX HYDRA/VEG 15ML,5654
GELEE PROTECTYL APSOL T150,8986
GELEE TEINT HALE LEGER 01 AX/SO CN3 30ML,1709
GELEE TEINT HALE MAT 02 AX/SO CN3 30ML,1896
GINSENG BONNE MINE T50ml,70
GLM 300ML CACAO ET FRAMBOISE,1142
GLM 300ML CACAO ET ORANGE,2141
GLM 300ML CACAO ET PISTACHE,2690
GLM AVOINE PN2 FP300ML,2071
GLM F300 CITRON VANILLE,175
GLM F300 FLEURS CRISTALLISEES,166
GLM F300ML FLEUR FEER,92
GLM F300ML FRUIT MERV,108
GLM JDM FLEUR DE LOTUS FP200ML,17148
GLM JDM LAVANDIN FP200ML JDM3,1168
GLM JDM YLANG YLANG FP200ML,11
GLM OLIVE PN2 FP300ML,3156
GLM VANILLE PN2 300ML,2455
GLOSS BAIE NOEL11 AX/TD LU3 7ML,1
"GLOSS BEIGE DORE ETE14 ANI LU4 4,5ML",457
"GLOSS BLEU/CRISTA IT/COL AOUT13 L4 4,5ML",266
"GLOSS CORAIL NACRE HIV14 ANI LU4 4,5ML",643
"GLOSS CORAIL/TEND IT/COL AOUT13 L4 4,5ML",592
"GLOSS ECLAT ARGENT HIV13 ANI LU4 4,5ML",290
GLOSS GELEE FRUITEE FRAMB PN2 10ML,6565
"GLOSS GRENAT NOEL12 LU4 ANIM 4,5ML",207
"GLOSS HIBIS/ROSE ETE13 ANI LU4 4,5ML",280
"GLOSS HIBISC/RGE ETE13 ANI LU4 4,5ML",159
GLOSS LEV MANDARINE OS11 PN 10ML,1096
GLOSS LEVRES ABRICOT PN T10ML,2474
"GLOSS MAUVE IT/COL AOUT13 LUM4 4,5ML",358
"GLOSS MURE 41 LUM4 4,5ML",2571
"GLOSS OR SCINTIL NOEL12 L4 ANI 4,5ML",277
"GLOSS PECHE 21 LUM4 4,5ML",1024
"GLOSS PECHE MELBA ETE13 ANI LU4 4,5ML",234
"GLOSS PRALINE 71 LUM4 4,5ML",1679
GLOSS REPULP COCO CN3 09 5,1
GLOSS REPULP FRAISE CN3 09 5,1
GLOSS REPULP NOISETTE CN3 09 5,4
"GLOSS RGE/ORANG IT/COL AOUT13 L4 4,5ML",402
"GLOSS ROS/CASHM NOEL12 L4 ANIM 4,5ML",72
"GLOSS ROSE LEGER 11 LUM4 4,5ML",3429
GLOSS ROSE NYMPHEA A/T MAI11 LU3 7ML,1
"GLOSS ROSE VIF ETE14 ANI LU4 4,5ML",741
"GLOSS ROUGE INTENSE 31 LUM4 4,5ML",839
GLOSS SEXY PUL COR/CLAI10 ETE13 CN3 10ML,351
GLOSS SEXY PULP OR AUTOMNE14 10ML,1446
GLOSS SEXYPULP BEIGE DORE 07 CN3 10ML,1128
GLOSS SEXYPULP CARAMEL 05 CN3 10ML,794
GLOSS SEXYPULP CORAIL 01 CN3 10ML,825
GLOSS SEXYPULP CRISTAL 08 CN3 10ML,2191
GLOSS SEXYPULP NUDE ROSE 06 CN3 10ML,1364
GLOSS SEXYPULP RGE SOMBRE 04 CN3 10ML,1462
GLOSS SEXYPULP ROSE INDI 02 CN3 10ML,1800
GLOSS SEXYPULP ROSE VIF 03 CN3 10ML,2903
"GLOSS SOLEIL CUIVRE ETE14 ANI LU4 4,5ML",342
"GLOSS TERR/BRUL ETE12 LU4 ANI 4,5ML",84
"GLOSS TRANSP/SCINTI 01 LUM4 4,5ML",2967
GLOSS TRANSPARENCE LU HV06 4.5ML,4
GLOSS VOLUME TAUP/ROS OS12 CN3 10ML,188
GM 200ml FRUITS ROUGES,36069
GM 300ML CACAO ET FRAMBOISE,484
GM 300ML CACAO ET PISTACHE,553
GM CACAO ET ORANGE 300ML,293
GM F300 CITRON VANILLE,37
GM F300 FLEURS CRISTALLISEES,162
GM F300ML FLEUR FEER,1
GM FRUITS NOIRS 200 ML,32391
GM PAILLETE 250ML CACAO  FRAMBOISE,157
GM PAILLETE 250ML CACAO  ORANGE,510
GM PAILLETE 250ML CACAO  PISTACHE,1093
GOMM ABRICOT  BTE CROQUER T50,45335
GOMMAGE CLE MINCEUR 150 ML,3527
GOMMAGE DETOX TUBE 150ML,3293
GOMMAGE DOUCEUR PURE CAL 75ml,17590
GOMMAGE GOURMAND ABRICOT T50ml,276
GOMMAGE PURIFIANT SEBOVEG 75ML,11713
GR SOIN REGEN RICHE CREME 75ML,3
GRAND SOIN RICHE CREME P75ml,9357
GRANDE BEAUTYBOX 2014 YR,3947
GRANDE PALETTE CN 2013,514
HAMAMELIS SH 3EN1 FL300ML,1
HLE MASS TRAD HAMMAM FL100,7913
HUILE CORPS PAILL CACAO ORANGE,616
HUILE DOUCHE TRAD DE HAM. FL200ML,21686
HUILE IP6 FL150 PROT VEG,3872
HUILE Pailletee150ML FUNTASTIC,5215
HUILE REPARATRICE 150ML,11129
HUILE SECH BRONZ.2 125ML MONOI,68
HUILE SECHE MDT 125 ML,28619
HUILE SECHE SUBLIMANTE 100 ML SVC,15658
HUILE SPF 30 PV 150 ML,2660
HUILE TIARE TRAD.100ML MONOI,6
HYDRA LAIT DEMAQ FL200ML,10468
HYDRA PROT IP30 POCKET FL40 PROT VEG,1
HYDRA SEVE NUIT HYDRASP P50ML,1
HYDRA TONIQUE FL 200ML,13881
ILLUMI SCULPT CUIVR/DOR01 ETE14 CN3 15ML,1495
J-14 LIFTING SILHOUETTE FLP 150ML,58
"KHOL FONDANT NOIR 00 CN3 2,5G",839
"KHOL OR AUTOMNE14 1,3G",2039
"KHOL VIOLINE AUTOMNE14 1,3G",2230
"LA CURE ADN2 28 X 0,8ml",6
LAIT 200ML SO ELIXIR PURPLE,1124
LAIT 3 EN 1 IP30 FL 150ML PRO VEG,25
LAIT 3EN1 PROTECTYL AP SOL FL150,61617
LAIT AGRUMES FP FL200ML,3323
LAIT AVOINE PN2 FL50ML,1691
LAIT COCO PN2 FL50ML,11297
LAIT CORPS 300ML CACAO  FRAMBOISE,587
LAIT CORPS 300ML CACAO  PISTACHE,1108
LAIT CORPS CERISIER UMAJ FL200ML,7429
LAIT CORPS F300 CITRON VANIL,35
LAIT CORPS F300 FLEURS CRIST,84
LAIT CORPS F300ML FLEUR FEER,6
LAIT CORPS F300ML FRUIT MERV,3
LAIT CORPS FRUITS NOIRS 200ML,9770
LAIT CORPS HAMAMELIS FL300 ML,1831
LAIT CORPS LOVE FI 200 ML,1071
LAIT CORPS NATURELLE FL200ML,156
LAIT CORPS PUR DESIR PIVOINE FL 200 ML,2
LAIT CPS HTE RECONSTRUCT fl p 200ml,4527
LAIT DE PARF VOILE AMBRE SE FL 200ML,168
LAIT DE TOILETTE PC 200ML,5931
LAIT DEM BIO.SPE.AC.SENS.150ML,9143
LAIT DEMAQ 2010 SV FL200ML,8322
LAIT DEMAQ 3 THES FL200ML,9325
LAIT DOUCHE TRAD DE HAM FL200ML,8925
LAIT ENFANT IP30 FL150 PROT VEG,1
LAIT FLOWERPARTY FL200ML,1597
LAIT FRAMBOISE PN FL50ML,15270
LAIT IP15 FL150 PROT VEG,5
LAIT IP6 FL150 PROT VEG,4280
LAIT IRIS SECRETS ESSENCES FL200ML,1
LAIT JASM SEC ESS FL 200ML,543
LAIT LILAS FP FL200ML,5762
LAIT MANDARINE PN FL50ML,30
LAIT MURE PN2 FL50ML,10898
LAIT NEROLI SEC ESS FL 200 ML,1485
LAIT OLIVE PN2 FL50ML,3411
LAIT PARF CORPS 200ML EVIDENCE,52
LAIT PARF F200 ML EVIDENCE,11257
LAIT PARF UN BONHEUR FL200ML,1242
LAIT PARFUME 200 ML FLOWERPARTY BY NIGHT,846
LAIT PARFUME L'ELIXIR FL200ML,266
LAIT PARFUME VANILLE NOIRE SE FL200ML,516
LAIT PECHE PN2 FL50ML,9641
LAIT REPARATEUR KARITE 150ML,13865
LAIT ROSE FL 200ML SECRETS ESSENCES,1
LAIT ROSE FP FL200ML,6733
LAIT VANILLE PN2 FL50ML,10636
LAIT VELOUTE AVOINE PN2 400ML,5392
LAIT VELOUTE COCO PN2 400ML,9829
LAIT VELOUTE FRBOISE PN FL400ML,5478
LAIT VELOUTE MURE PN2 FL400ML,4012
LAIT VELOUTE OLIVE PN FL400ML,3777
LAIT VELOUTE PECHE PN FL400ML,4174
LAIT VELOUTE VANILLE PNFL400ML,7882
LAQU LEVR BRUN/GRENATCN3 09 5,2
LAQUE LEVR OCRE/NUDE CN3 09 5,3
LAQUE LEVR ORANG/LATERCN3 09 5,1
LAQUE LEVR ROS/DES SABL CN3 09 5,1
LAQUE LEVR VIOL/QUARTZCN3 09 5,2
LC VANILLE ED OR 2013 400ML,563
LC VANILLE ED OR 50 ML 2013,2124
LE PARFUM   EVIDENCE  VAPO 30ML,1587
LIFTING CORPS ENRICHI++SVH 150,13
"LINER SOLEI/BLEU ETE12 LU4 ANIM 2,5ML",7
LINGETTES CALMILLE 2013,62327
LINGETTES DEMAQ 3 THES,9019
LIPLINER RETRA MAUV/BOIS21 CN3 2013 0.3G,3565
LIPLINER RETRAC BOIS ROS71 CN3 2013 0.3G,2434
LIPLINER RETRAC RGE FONC32 CN3 2013 0.3G,3633
LIPLINER RETRACT BEIGE51 CN3 2013 0.3G,2096
LIPLINER RETRACT ROUGE31 CN3 2013 0.3G,2592
LISSAGE AP SHAMPOING LISSANT 150ML SVC,8239
LISSAGE SERUM LACTE LISSANT 100 ML,3769
LISSAGE SHAMPOING LISSANT 300ML SVC,8468
LOTION 3 THES FL200ML,9945
LOTION FL NUTRISP 150 ML,12
LOTION FLORALE PC 200ML,5872
LOTION PORE MINIMIZER 150ML,9068
LOTION SEBO SPECIF FL150,735
LOTION SV 2010 FL200ML,5470
LTN DERM/AP BIO.SPE.AC.SENS.150ML,8595
Lait PN Poire Caramel FL400 Ml,4771
MASC ARGENT 91 HIV14 ANIM LUM4 4 ML,569
MASC BLEU LAG ETE13 ANI LU4 4ML,207
MASC EXTENS BLEU CN3 2009 5ML,449
MASC EXTENS BRUN CN3 2009 5ML,517
MASC EXTENS NOIR CN3 2009 5ML,483
MASC LONG 360 WP NOIR 01 CN3 8ML,9456
MASC LONG NOIR 01 OS11 CN3 8ML,4
MASC PAILLETE OR NOEL11 A/T LU3 4ML,1
MASC SEXYPULP BLEU 03 CN3 9ML,5953
MASC SEXYPULP BRUN 02 CN3 9ML,6259
MASC SEXYPULP NOIR 01 CN3 9ML,45666
MASC ULTRA VOL NOIR01 OS12 CN3 9ML,26
MASC ULTRA VOL NOIR01 OS13 CN3 9ML,648
MASC VOLUME BLEU CN3 2009 5ML,2212
MASC VOLUME BRUN CN3 2009 5ML,1843
MASC VOLUME NOIR CN3 2009 5ML,10349
MASC WATER NOIR 01 AX/SO CN3 9ML,15219
"MASCARA BEAUTE BRUN 71 LUM4 6,5ML",2125
"MASCARA BEAUTE NOIR 81 LUM4 6,5ML",11238
MASCARA DEPLOYE BLEU 03 CN3 9ML,3596
MASCARA DEPLOYE BRUN 02 CN3 9ML,3259
MASCARA DEPLOYE NOIR 01 CN3 9ML,17414
MASCARA LONG ANTHRACIT03 CN3 8ML,2595
MASCARA LONG BRUN 02 CN3 8ML,2389
MASCARA LONG NOIR 01 CN3 8ML,13347
MASCARA OR ETE14 ANI LUM4 4ML,957
MASCARA SOIN BLEU03 2014 CN3 9ML,730
MASCARA SOIN BRUN02 2014 CN3 9ML,977
MASCARA SOIN NOIR01 2014 CN3 9ML,6178
MASCARA VOL VERTIGE BLEU CN3 9ML,3864
MASCARA VOL VERTIGE BRUN CN3 9ML,4014
MASCARA VOL VERTIGE NOIR CN3 9ML,32410
MASQ CONFORT EXTREM BIO SPEC75,4299
MASQ FLASH DES ASPHYX CS 50ML,739
MASQ SOS SOIF 75ML GEST/INSTITUT,1814
MASQUE 3MIN GRENADE 50ml,1325
MASQUE AQUA TONIC RAISIN T50ml,1089
MASQUE CITRON 3MINS T50ml,423
MASQUE HYDRA VEGETAL T75ML,3896
MASQUE NUTRI NUTRIT/VEGETAL T75ML,4641
MASQUE PEEL OFF 75ML GEST/INSTIT,1687
MASQUE PURE SYSTEM 2X4ML,4215
MASQUE PURE SYSTEM T50 50ML,9482
MASQUE PURETE SEBOVEGETAL 75ML,8532
MASQUE SUPRA LIFT OV/LIF T40ML,2609
MASQUE VIS TRAD DE HAM T100ml,8258
MAXI DCHE PURE HAMAMELIS FL500ML,2550
MAXI LAIT DOUCEUR HAMAMELIS3 FL500ML,1598
MAXI SHAMP DOUCEUR HAMAMELIS3 FL500ml,8
MAXI SPRAY FL200ML VPM,4889
MDT HUILE SECHE PREC VPM 100ML,11659
MDT HUILE TIARE TRAD VPM 100ML,12639
MDT SD DES LAGONS 150 ML,64400
MONOI EAU HYDRA PARF FP 125 ML,20588
MOUS A RAS GINSENG 150ML,1
MOUSSE A RASER SENSITIVE,5871
MOUSSE DEMAQ 3 THES T150ml,1791
MSQ CRANBERRY BTE CROQUER T50,35455
NACRES LIBR OR ULTRA NACRE AUTOMNE14 3G,966
NACRES LIBRES CRISTAL CN3 3G,1092
NACRES LIBRES CUIVREES CN3 3G,349
NACRES LIBRES DOREES CN3 3G,598
NACRES LIBRES ROSES CN3 3G,457
NACRES LIBRES TAUPES CN3 3G,619
NETTOYANT DESINCRUSTANT 125ML,21348
NETTOYANT DX SEBO SPE FL150,1332
NUTRI GEL NETT T125ML,7923
NUTRI LAIT DEMAQ VELOUTE F200ML,4560
NUTRI T CORPS NUTRISP 150 ML,5
NUTRI TONIQUE CONFORT F200ML,5791
OMBR CR ULTR/LG TEN BLEU/FR04 CN3 7ML,2790
OMBR CR ULTR/LG TEN BLEU/MAUV05 CN3 7ML,1803
OMBR CR ULTR/LG TEN BRONZE07 CN3 7ML,2120
OMBR CR ULTR/LG TEN BRUN/NOIR08 CN3 7ML,1083
OMBR CR ULTR/LG TEN MAUVE02 CN3 7ML,2882
OMBR CR ULTR/LG TEN MERCURE03 CN3 7ML,3121
OMBR CR ULTR/LG TEN NUDE01 CN3 7ML,4513
OMBR CR ULTR/LG TEN PRUNE09 CN3 7ML,1188
OMBR CR ULTR/LG TEN TURQUOIS06 CN3 7ML,1146
OMBRE CR LT CUIVRE11 ETE14 CN3 7ML,509
OMBRE CR LT VIEUX ROSE10 ETE14 CN3 7ML,890
OMBRE CREME BRUN PRECIEUX AUTOMNE14 7ML,595
OMBRE CREME OR AUTOMNE14 7ML,1494
OMBRE+LINER AMETHYSTE CN3 4ML,360
OMBRE+LINER JADE CN3 4ML,292
OMBRE+LINER LAPIS/LAZULI CN3 4ML,354
OMBRE+LINER PIERRE/LUNE CN3 4ML,492
OMBRE+LINER QUARTZ/FUME CN3 4ML,394
OMBRE+LINER TURQUOISE CN3 4ML,347
OS CR DELIC POMME PN50 VPM,37
OS EXFOL CORPS POMME50 VPM PN,30
P DUO 2012 CN3 3G BLC ETIN ET VERT CAN,731
PAL FAP VERT/BLEU MAI11 A/T LU3 2X1.5G,2
PAL YX AMB/CANN/CHAT NOEL11 A/T LU3 3X1G,1
PAL YX AMET/LAPIS/OR NOEL12 L4 ANIM,81
PALETTE MAQUILLAGE 2012 CN3,50
PALETTE PUZZLE MAQ OS2009 CN3,1
PATCH STOP BOUTONS,3254
PATE PUR 2EN1 T75ML GEST/INSTIT,1298
PC TEINT BEIGE CLAIR 10G LUMINELLE 4,4088
PC TEINT BEIGE FONCE 10G LUMINELLE 4,4519
PC TEINT BEIGE MOYEN  10G LUMINELLE 4,8085
PDRE HAL/LEGER01 AX/SOLA CN3 20G,15115
PDRE LIBRE SOL/CUIVR NOEL11 A/T LU3 15G,2
PDRE LIBRE TRANSPARENCE LUM4 15G,2575
PDRE RAY JEUN BEIGE200 TT CLAIR CN3 8G,1059
PDRE RAY JEUN BEIGE400 TT MAT CN3 8G,1451
PDRE RAY JEUN BGE100 TT TR CLAIR CN3 8G,398
PDRE RAY JEUN BGE300 TT MEDIUM CN3 8G,1941
PDRE TT TEINTE UNIVERSELLE OS13 CN3 8G,354
PEEL VEG T75ML GESTES INSTITUTS,5171
PERLES SOLEIL ETE13 ANI LU4 28G,15
PETIT SAVON COCO PN 50G VPM,8866
PETIT SAVON FRAISE PN 50G VPM,5306
PETIT SAVON FRAMBOISE PN 50G VPM,9519
PETIT SAVON MURE PN 50G VPM,7018
PETIT SAVON PECHE PN 50G VPM,6953
PETIT SAVON VANILLE PN 50G VPM,7487
PETITE PALETTE CN 2013,487
"PINCEAU COMBLANT SV40 2,4ml",1
PORE MINIMIZING SERUM SEBOV 30ML,4360
PORTE MINE BLEU FLASH 02 CN3 0.3G,17346
PORTE MINE CUIVRE 06 CN3 0.3G,7562
PORTE MINE NOIR 01 CN3 0.3G,63371
PORTE MINE TURQUOIS 05 CN3 0.3G,15371
PORTE MINE VERT 03 CN3 0.3G,13655
PORTE MINE VIOLET 04 CN3 0.3G,9773
PORTE MINE YEUX BRUN08 ETE13 CN3 0.3G,235
"PORTE MINE YEUX DORE 10 CN3 0,3G",4760
"PORTE MINE YX ANTHRACITE CN3 0,3G",18905
PORTE MINE YX VERT ACID07 ETE13 CN3 0.3G,168
POUDRCORPSPAILLE FRUITSNOIR,3697
POUDRE LIBRE TRANSP/BEIGE CN3 20,10052
POUDRE LIBRE TRANSP/ROSEE CN3 20,7511
POUDRE MATITE CLAIR CN3 8G,4139
POUDRE MATITE MAT CN3 8G,4189
POUDRE MATITE MEDIUM CN3 8G,6342
POUDRE MATITE TRES CLAIR CN3 8G,1542
"QUATUOR FAP AQUATI SUB03 2014 CN3 4x1,2G",344
"QUATUOR FAP BLEU ECLAT04 2014 CN3 4x1,2G",363
"QUATUOR FAP BRUN INCAN06 2014 CN3 4x1,2G",1284
QUATUOR FAP GRIS PROF01 2014 CN3 4x1.2G,810
"QUATUOR FAP ROSE RAFFI05 2014 CN3 4x1,2G",1138
"QUATUOR FAP VERT RADIE02 2014 CN3 4x1,2G",276
R et E Cr Peau Mixte 50ml SV3,6579
"RAL BEIGE NUDE 71 LUM4 3,5G",2691
RAL BRILL CERISE NOIRE52 CN3 3.5G,4473
RAL BRILL CORAIL DOUX22 CN3 3.5G,2653
RAL BRILL IRIS MAUVE41 CN3 3.5G,3215
RAL BRILL MARRON GLACE12 CN3 3.5G,2678
RAL BRILL MIEL DORE11 CN3 3.5G,2475
RAL BRILL RGE GROSEILLE51 CN3 3.5G,2733
RAL BRILL ROSE COCKTAIL32 CN3 3.5G,3196
RAL BRILL ROSE GRENAD31 CN3 3.5G,2845
RAL BRILL ROSE VIF42 CN3 3.5G,3513
RAL BRILL SIENNE62 CN3 3.5G,2120
RAL BRILL TANGERINE61 CN3 3.5G,2120
RAL BRILLANC GEL/AMBRE CN3 2G,395
RAL BRILLANC GEL/CARAMEL CN3 2G,380
RAL BRILLANC GEL/LITCHI CN3 2G,1216
RAL BRILLANC GEL/PRALIN CN3 2G,539
RAL BRILLANC GEL/TANGERIN CN3 2G,635
RAL BRILLANCE GEL/CASSIS CN3 2G,875
RAL BRILLANCE GEL/CERISE CN3 2G,741
RAL BRILLANCE GEL/GROSEIL CN3 2G,749
RAL BRILLANCE LITCHI21 CN3 3.5G,3275
"RAL CHOCOLAT 73 LUM4 3,5G",2963
"RAL CORAIL 22 LUMINELLE4 3,5G",3853
RAL CR HYD BEIG/GINGEMB CN3 09 3.7,769
RAL CR HYD BEIG/SESAME CN3 09 3.7,1418
RAL CR HYD BEIG/VANILL CN3 09 3.7,1344
RAL CR HYD BOIS DE ROSE CN3 09 3.7,1376
"RAL CR HYD BRUN NOISET82 AX/SO CN3 3,7G",673
RAL CR HYD MAUV/ALCECN3 2009 3.7,2594
RAL CR HYD MAUV/PENSECN3 2009 3.7,2601
RAL CR HYD ORANG/CAPUCINCN3 09 3.7,808
RAL CR HYD ORANG/HIBISC CN3 09 3.7,516
RAL CR HYD ORANG/MUSCAD CN3 09 3.7,610
RAL CR HYD PETIT/MAUVCN3 2009 3.7,2906
RAL CR HYD RGE BOISE OS12 CN3 3.7G,85
RAL CR HYD ROS/CENTIFOL CN3 09 3.7,2075
RAL CR HYD ROS/DAMAS CN3 09 3.7,2034
RAL CR HYD ROS/FUCHSCN3 2009 3.7,967
RAL CR HYD ROS/GALICA CN3 09 3.7,2071
RAL CR HYD ROSE THE CN3 09 3.7,1829
RAL CR HYD ROSE/CANNELL CN3 09 3.7,2379
RAL CR HYD ROUG/COQUEL CN3 09 3.7,2336
RAL CR HYD ROUG/GRENAD CN3 09 3.7,1334
RAL CR HYD ROUG/PAVOT CN3 09 3.7,2388
"RAL CR HYDR BR/CHOCOL83 AX/SO CN3 3,7G",1125
"RAL CR HYDR BRUN NUD81 AX/SO CN3 3,7G",546
RAL CR HYDR PIGM BEIGE104 CN3 3.7,6
RAL CR HYDR PIGM FUSCH101 CN3 3.7,1
RAL CR HYDR PIGM MAUV106 CN3 3.7,2
RAL CR HYDR PIGM ROSE 105 CN3 3.7,3
RAL CR HYDR PIGM TOMET103 CN3 3.7,4
RAL CR HYDR PIGMENT RGE102 CN3 3.7,1
RAL CR HYDR ROS/ALBA CN3 2009 3.7,1224
RAL CR HYDR ROS/ISPAHCN3 2009 3.7,1121
"RAL CR HYDRAT AMETHYSTE AUTOMNE14 3,7G",664
"RAL CR HYDRAT VIOLINE AUTOMNE14 3,7G",1056
"RAL FRAMBOISE 14 LUM4 3,5G",5809
"RAL GRAND RGE BGE/CHAL CN3 2013 3,7G",651
"RAL GRAND RGE BGE/RAD CN3 2013 3,7G",1037
"RAL GRAND RGE BRUN/ARD CN3 2013 3,7G",1063
"RAL GRAND RGE COR/INCAN43 CN3 2013 3,7G",1418
"RAL GRAND RGE CORA/ETIN41 CN3 2013 3,7G",1737
"RAL GRAND RGE CORA/VOIL42 CN3 2013 3,7G",1818
"RAL GRAND RGE MAUV/PAST21 CN3 2013 3,7G",1604
"RAL GRAND RGE MAUV/SUBT22 CN3 2013 3,7G",2286
"RAL GRAND RGE RGE/GOUR33 CN3 2013 3,7G",1927
"RAL GRAND RGE RGE/RAYON32 CN3 2013 3,7G",1695
"RAL GRAND RGE ROS/ECL12 CN3 2013 3,7G",1691
"RAL GRAND RGE ROS/EQUIV73 CN3 2013 3,7G",1799
"RAL GRAND RGE ROS/HAL72 CN3 2013 3,7G",1181
"RAL GRAND RGE ROS/PDRE71 CN3 2013 3,7G",1533
"RAL GRAND RGE ROS/PETIL11 CN3 2013 3,7G",2203
"RAL GRAND RGE ROS/SOMPT13 CN3 2013 3,7G",2000
"RAL GRAND RGE ROUGE VIF31 CN3 2013 3,7G",1952
"RAL GRAND RGE VIOL/PROF23 CN3 2013 3,7G",2519
RAL GRD RGE OR COLLECTOR14 3.7GR,750
"RAL GRD RGE RGE/BORDE34 OS13 CN3 3,7G",253
"RAL GRD RGE VIOL/LUMI24 OS13 CN3 3,7G",317
"RAL MARRON GLACE 72 LUM4 3,5G",3706
"RAL MAUVE POUDRE 41 LUM4 3,5G",4392
"RAL MURE 42 LUMINELLE4 3,5G",7338
"RAL PECHE 21 LUMINELLE4 3,5G",1788
"RAL POMME D'AMOUR 31 LUM4 3,5G",4794
RAL RGE GLOSSY FRAMB/GIV LU3 MOND3.5G,2
"RAL ROSE BONBON 11 LUM4 3,5G",3466
"RAL ROSE POUDRE 12 LUM4 3,5G",3209
"RAL ROSE SORBET 13 LUM4 3,5G",3950
"RAL ROUGE PRUSSIEN HIV13 ANI LU4 3,5G",361
"RAL VIOLINE HIV13 ANI LUM4 3,5G",405
RAL ZERO DEF PISTIL BEIGE CN3 2g,6
RAL ZERO DEF PISTIL BOISE CN3 2g,6
RAL ZERO DEF PISTIL BORDEAUX CN3 2g,4
RAL ZERO DEF PISTIL BRUN CN3 2g,5
RAL ZERO DEF PISTIL FUSHIA CN3 2g,8
RAL ZERO DEF PISTIL ORANGE CN3 2g,8
RAL ZERO DEF PISTIL ROSE CN3  2g,5
RAL ZERO DEF PISTIL ROUGE CN3 2g,5
REACTIV LUMIERE ELIX7.9 FL30ml,1225
RECH DCHE DOUCEUR HAMAMELIS 250ML,1704
RECH GEL DOUC MAINS HAMAMELIS 250ML,2398
RECH SHAMP DOUCEUR HAMAMELIS 250 ML,39
RECH SOIN OPT 1ereRIDES  INOS40,1
RECH SOIN RECUPER NOCT INOS40,6
RECHARGE CR ECLAT INOS P40ml,2
RED RIDE YX BIOSPEC T15,972
REPACK 2013COLLECTOR RC2 P75ml,430
REPACK AR BIEN JOUR RC2 P 50ml,24457
REPACK AR BIEN NUIT RC2 P 50ml,11880
REPACK CONTOUR YEUX RC2 P15ml,10558
REPACK SHP BRIL ECOLABEL 300ML,13535
REPULPEUR EXTREME  SV3 30ML,2884
RICHE CREME REPACK YEUX 15ML,62
RIDES+ECLAT CR NUIT P50ml SV40,7244
RIDES+FERMETE JOUR P50ml SV40,16416
RIDES+FERMETE NUIT P50ml SV40,7632
ROLL ON LISSANT CS T15ml,1396
ROLL ON REGARD ELIXIR7.9 t15ml,6662
ROLL-ON  VANILLE NOIRE 10ML S.E,19
RPACK ELIX DE BEAUTE RC2 10ml,3466
RetE Roll-on rajeunissant SV15,5451
SAV ORIENTAL TRAD HAMMAM 150g,4895
SAVON  PN POMME VPM,8
SAVON 100g CITRON FDN 2012 VPM,122
SAVON 100g MAUVES FDN 2012 VPM,108
SAVON AVOINE PN2 300G VPM,1733
SAVON FP 50g VPM,3
SAVON FRAISE VPM PN2 100G,665
SAVON FRAMBOISE VPM PN2 100G,146
SAVON LAIT DE COCO VPM PN2 100G,78
SAVON OLIVE PN2 300G VPM,2572
SAVON PECHE VPM PN2 100G,475
SAVON PN MIEL 300g VPM,2
SAVON PN2 MURE VPM 100G,482
SAVON VANILLE VPM PN2 100G,359
SD RETROPICAL FL200ML,1513
SELS DE BAIN 15GR AGR FLEURS,143
SELS DE BAIN 15GR LILAS MAUVE,228
SELS DE BAIN 15GR ROSE FRAICHE,160
SER BOUCLIER ANTIOXY24H 30mlCS,316
SER PERF ANTI TACHES 0 DEFAUT 30ML,486
SERUM CLE VEGETAL MINCEUR  150ML,9723
SERUM INT JEUNESSE ELX7.9 30ml,8326
SERUM RADIANCE 40ml ADN VEG,692
SERUM RESCULPT OVALE LIFT 30ML,3072
SERUM SOS HYDRA/VEG FP30ML,5272
SH 100ML POMME DE REINETTE,50
SH DCH HOGGAR 200 ML,7212
SH. DOUCHE NATURE HOMME 200ML,4623
SHAMP BRILLANCE ECOLABEL 300ML,2077
SHAMP HAMAMELIS FL300ML,3
SHAMPOOING 250ML POMME D'API,3
SHP PHYTUM ANTI-AGE 200ML,1
SHPG DCHE TIARE ANIM MONOI FL150ML,2
SO ELIXIR AERO  DEO PARFUME 100ML,317
SOIN 3EN1 GINSENG HOM T50ml,1
SOIN 3en1 SENSITIVE YRmen 50ml,7109
SOIN AA PxSENSIBLE ELIX Fl30ml,3166
SOIN CONC COMP RC2 FL POMP40ML,959
SOIN COSM ORALE 3X10 CAPS RC2,1
SOIN EXFOL ONGL/CUTIC MANUCURE CN3 5.5,1718
SOIN ONGLES FORTIFIES MANUC CN3 10G,2860
SOIN OPTIMAL 1ERE RIDES INOS P40,3
SOIN RECUPERATEUR NOCT INOS 40,12
SOIN REDUCT RIDES VIS ACT SENS,1285
SOIN REGAL JOUR OVALE LIFT 50ML,7154
SOIN STOP IMPERF PURE SYSTEM T40 40ML,9789
SOIN TEINTE SV3 50ML,2706
SOIN VITALITE 24H 50mlCURE SOL,1132
SOS JAMB/LOURDE SPA VEG FL 200,1
SOS MAINS PROPRE T30ML SVC,17869
SPOT CORRECT PURE SYSTEM T10 10ML,298
SPRAY 3EN1 IP30 FL150 PROT VEG,3160
SPRAY HYD PROT 15 FL150 PROT VEG,3255
SPRAY IP50+ PROTECT VEG  FLP150ml,3437
SPRAY SCULPTANT 150ML,4666
SPRAY VOLUME 200ML,4284
STICK COR ZERO DEF BGE CLAIR01 CN3 1.4G,11832
STICK COR ZERO DEF BGE MOYEN02 CN3 1.4G,13084
STOP CORRECTEUR MALIN 1.4G SEBO,1705
STYLO LEVR ZERO DEF INCOLORE81 CN3 0.3G,1276
STYLO RAYON JEUNES DORE03 CN3 1.5ML,2430
STYLO RAYON JEUNES ROSE01 CN3 1.5ML,1669
STYLO RAYON JEUNESSE BEIGE02 CN3 1.5ML,5639
STYLO TEINT ECLAT BEIGE CN3 1.5G,1053
STYLO TEINT ECLAT ROSE CN3 1.5G,706
SUNNYTINT SOLEIL ETE13 ANI LU4 15 ML,138
SVA HYDR HALE PROG COR FL150ML,4211
SVA HYDRA HALE PROG VIS T50ml,4295
SVC 3en1  nutritotal T150ml,23240
SVC A AGE MASQUE 150ml,1204
SVC A AGE SH REVITALISANT 200ML,2950
SVC ANTICHUTE SH STIM Fl200ml,11887
SVC ANTIPELL SH TRAITANT FL200ML,8018
SVC ANTIPEOL LOTION VPM 150ML,733
SVC AS NOURRISSANT T150ML,2
SVC BAUME GRAND FROID pot 50ml,8216
SVC BRILLAN MASQ ECLAT P150ml,1
SVC BRILLANCE SH 300ML,10931
SVC BRILLANCE SH ECLAT FL200ML,2
SVC CR MAINS ET ONGLES T75ml,35658
SVC CREME NOURRISSANTE T50ml,15485
SVC CREME QUOTIDIENNE T75ml,72394
SVC DEMEL 3EN1 SH 300ML,13993
SVC DOUCEUR SH 300ML,11060
SVC ECLAT COULEUR AP SH 150ML,10720
SVC ECLAT COULEUR SH 300ML,16877
SVC ECLAT COULEUR SPRAY 150ML,1614
SVC EXFO GOMMAGE VEG T150ml,27903
SVC FERM 2en1 HYD FERM Fl200ml,5052
SVC FERM BAU EXPFERMETE P150ml,679
SVC FERM LIFTING BUSTE Fl100ml,4203
SVC HYDRA 2EN1 ANTIREP Fl200ml,2845
SVC HYDRA HYDR VELOURS Fl 200ml,4725
SVC HYDRA NOURRIST Fl200ml,8640
SVC JAMB SOS JLOURDES F200ml,7726
SVC Mini CREME Hyd T30ml,35
SVC NUTRI 2 MASQ NUTRI P150ml,3142
SVC NUTRI BAUM REP PTE SEC T50ML,2
SVC NUTRITION AP SH 150ML,11575
SVC NUTRITION SH 300ML,11986
SVC PIEDS BAUME REP T50ml,17149
SVC PIEDS CR DEO 12H T50ML,7756
SVC PIEDS PAST EFF RELAX,7601
SVC PIEDS SOS P ECHAUF T50ML,21014
SVC PURETE SH 300 ML,20105
SVC PURETE SH PURIF FL200ML,1
SVC REFLETS SH REF ARG FL200ML,5857
SVC REFLETS SH REF CHAT FL200ML,4950
SVC REFLETS SH REF DOR FL200ML,7640
SVC REP BAUME REP P150ml,5323
SVC REP LAIT REP T150ML,63864
SVC REPARATION AP SH 150 ML,14758
SVC REPARATION MASQUE 150ml,5736
SVC REPARATION SH 300ML,18209
SVC SHAMP ANTIPEL FL300ML,4981
SVC TRAN EAU DEML TILL FL200ML,33
SVC TRAN VIN RINC FRBOI FL150ML,35
SVC VOLU SH VOLUMATEUR FL200ML,17
SVC VOLUME SH 300ML,15197
SVC VOLUME SPR VOL  FL200ML,31
SVC pieds cr nourr T50ml,28881
SVC pieds gommage T50ml,18706
Soin Redens Vis Ovale Lift50ml,4189
Soin Rehausseur Regard 14ml OL,3070
TEINT ENSOLEILLE BRONZ NAT 75,1
TENSEUR Y ENERGIE T 15ML,1516
TRIO BRONZ TERRE SOLEIL ETE14 LU4 VPM15G,4147
TRIO FAP PECH/BLEU/EUCAL ETE13 LU4 3G,157
TRIO REGARD BLEU/BRONZ/BGE ETE14 LU4 3G,1237
TRIO REGARD OS13 CN3 7G,178
U LEVR TERR/SIENNECN3 09 5,4
ULTRA CONFORT JOUR NUTRISP T40ML,4
ULTRA CONFORT NUIT NUTRISP P50ML,1
ULTRA PURETE SEBOSPECIFIC TUBE 125ML,1246
UMAJ GD CERISIERS FL200ML,16342
UMAJ GD MUGUET FL 200ML,13676
UMAJ LAIT MUGUET FL 200ML,5010
VAO AMETHYSTE AUTOMNE14 3ML,5452
VAO AMETHYSTE NOEL12 LU4 ANI 3ML,172
VAO ARGENT GIVRE 91 HIV14 ANI LU4 3ML,4982
VAO BAIE NOEL11 AX/TD LUM3 3ML,9
VAO BLANC FRENCH MANUCURE CN3 5.5ML,2132
VAO BLANC NEIGE 02 LUM4 3ML,8355
VAO BLANC PERLE03 IT/COL FEV14 LU4 3ML,5594
VAO BLEU AQUAREL 55 IT/COL AOUT14 L4 3ML,6237
VAO BLEU ARDOISE HIV13 ANI LU4 3ML,928
VAO BLEU BERMUDE ETE13 ANI LU4 3ML,79
VAO BLEU CHIC IT/COL AOUT13 LU4 3ML,165
VAO BLEU ENCRE 54 IT/COL AOUT14 LU4 3ML,4801
VAO BLEU NUIT 51 LUMINELLE4 3ML,8622
VAO BLEU PAON HIV13 ANI LUM4 3ML,1603
VAO BLEU ROI ETE14 ANI LUM4 3ML,4202
"VAO BRIL BEIG/NACR52 AX/SO CN3 5,5ML",2577
"VAO BRIL CERISE NOIRE113 ETE14 CN3 5,5ML",1242
"VAO BRIL GRIS INT107 OS13 CN3 5,5ML",1111
VAO BRIL ORANGE CHAUD43 ETE13 CN3 5.5 ML,625
"VAO BRIL PRUNE108 OS13 CN3 5,5ML",228
"VAO BRIL ROS/COCKTAIL111 ETE14 CN3 5,5ML",2799
VAO BRIL ROSE SOMPTUEUX 14 CN3 5.5ML,3647
"VAO BRIL ROUG/SIENN 33 AX/SO CN3 5,5ML",1357
VAO BRIL ROUGE BOISE OS12 CN3 5.5ML,39
VAO BRILL 2011 AUBERGINE102 CN3 5.5,3203
VAO BRILL 2011 CHOCOLAT 105 CN3 5.5,1408
VAO BRILL 2011 FRAMBOIS104 CN3 5.5,2667
VAO BRILL 2011 ROUGE 101CN3 5.5,2220
VAO BRILL 2011 RUBIS 103 CN3 5.5,3563
VAO BRILL 2011 TAUPE106 CN3 5.5,3354
VAO BRILL BLEU MAUVE24 ETE13 CN3 5.5 ML,129
VAO BRILL BRUN/ORANG LEGER CN3 5.5ml,1
VAO BRILL CORAIL/PAST CN3 5.5ml,507
VAO BRILL ROSE NUDE 13 CN3 5.5ML,2870
"VAO BRILL SIENNE112 ETE14 CN3 5,5ML",759
VAO BRILL TAUPE ROSE OS12 CN3 5.5ML,9
VAO BRILLANCE BORDEAUX CN3 5.5ml,3064
VAO BRILLANCE BRUN NOIR CN3 5.5ml,2247
VAO BRILLANCE BRUN PEAU CN3 5.5ml,3390
VAO BRILLANCE CORAIL VIF CN3 5.5ml,3786
VAO BRILLANCE CUIVRE42 ETE13 CN3 5.5 ML,414
"VAO BRILLANCE DORE110 ETE14 CN3 5,5ML",2211
VAO BRILLANCE MAUV/LEGER CN3 5.5ml,1931
VAO BRILLANCE MAUVE PDRE 23 CN3 5.5ML,2421
VAO BRILLANCE PERLE62 ETE13 CN3 5.5 ML,292
VAO BRILLANCE ROS/FUCHSIA CN3 5.5ml,2312
VAO BRILLANCE ROS/PASTEL CN3 5.5ml,4243
VAO BRILLANCE ROUG/GRENAD CN3 5.5ml,3405
VAO BRILLANCE ROUILLE 35 CN3 5.5ML,560
VAO BRILLANCE VIOLINE CN3 5.5ml,3056
VAO BRUN CUIVRE ETE14 ANI LUM4 3ML,3912
VAO CERISE NOIRE 32 LUM4 3ML,13382
VAO CORAIL GIVRE 23 HIV14 ANI LU4 3ML,3027
VAO CORAIL PEAU 22 IT/COL AOU14 LUM4 3ML,4915
VAO CRAQ BLEU/PROF ETE13 ANI LU4 3ML,53
VAO CRAQUELE BLEU/MEDIT ETE14 ANI L4 3ML,3553
VAO EBENE NOEL11 AX/TD LU3 3ML,1
VAO FUCHSIA 13 LUMINELLE4 3ML,14078
VAO GLITTER ECLAT/ARG HIV13 ANI LU4 3ML,176
VAO GLITTER ROS/PAILL HIV13 ANI LU4 3ML,104
VAO GLOSS REHAUSS BRILL MANUC CN3 5.5ML,8952
VAO HIBISCUS ROUGE ETE13 ANI LU4 3ML,614
VAO HISBISCUS ROSE ETE13 ANI LU4 3ML,503
VAO INDIGO NOEL12 LUM4 ANIM 3ML,24
VAO JAUNE CITRON ETE14 ANI LUM4 3ML,5751
VAO JAUNE/LUMIN IT/COL AOUT13 LU4 3ML,287
VAO JOLI TURQUOISE IT/COL AOUT13 LU4 3ML,123
VAO LILAS/SUBLIM IT/COL AOUT13 LU4 3ML,391
VAO MENTHE TROPIC ETE13 ANI LU4 3ML,85
VAO MENTHE64 IT/COL FEV14 LU4 3ML,5185
VAO NUANC TURQUOIS 56 IT/CO AOU14 L4 3ML,7754
VAO OMBRE POURPRE 43 IT/COL AOU14 L4 3ML,7354
VAO OR AUTOMNE14 3ML,6625
VAO OR ETE14 ANIM LUM4 3ML,7764
VAO OR SCINTIL NOEL12 LU4 ANI 3ML,104
VAO ORANGE SANGUINE 21 LUM4 3ML,7121
VAO ORCHIDE ROSE ETE13 ANI LU4 3ML,596
VAO PARME 41 LUMINELLE4 3ML,8268
VAO PASTEL BEIGE 01 MANUC CN3 5.5ML,877
VAO PASTEL PARME 03 MANUC CN3 5.5ML,4388
VAO PASTEL ROSE 02  MANUC CN3 5.5ML,1161
VAO PINK RUBIS NOEL12 LU4 ANI 3ML,24
VAO RAYON VERT NOEL12 LU4 ANI 3ML,13
